{"id":53081866,"description":null,"name":"callisto","name_with_namespace":"Mohamed Thasim / callisto","path":"callisto","path_with_namespace":"Thasim/callisto","created_at":"2023-12-15T05:02:08.928Z","default_branch":"main","tag_list":[],"topics":[],"ssh_url_to_repo":"git@gitlab.com:Thasim/callisto.git","http_url_to_repo":"https://gitlab.com/Thasim/callisto.git","web_url":"https://gitlab.com/Thasim/callisto","readme_url":null,"forks_count":0,"avatar_url":null,"star_count":0,"last_activity_at":"2023-12-15T05:02:08.928Z","namespace":{"id":79049517,"name":"Mohamed Thasim","path":"Thasim","kind":"user","full_path":"Thasim","parent_id":null,"avatar_url":"https://secure.gravatar.com/avatar/9a7fd6d3620a4a9d9de3bd55d5266887?s=80\u0026d=identicon","web_url":"https://gitlab.com/Thasim"},"container_registry_image_prefix":"registry.gitlab.com/thasim/callisto","_links":{"self":"https://gitlab.com/api/v4/projects/53081866","issues":"https://gitlab.com/api/v4/projects/53081866/issues","merge_requests":"https://gitlab.com/api/v4/projects/53081866/merge_requests","repo_branches":"https://gitlab.com/api/v4/projects/53081866/repository/branches","labels":"https://gitlab.com/api/v4/projects/53081866/labels","events":"https://gitlab.com/api/v4/projects/53081866/events","members":"https://gitlab.com/api/v4/projects/53081866/members","cluster_agents":"https://gitlab.com/api/v4/projects/53081866/cluster_agents"},"code_suggestions":true,"packages_enabled":true,"empty_repo":true,"archived":false,"visibility":"private","owner":{"id":19228764,"username":"Thasim","name":"Mohamed Thasim","state":"active","locked":false,"avatar_url":"https://secure.gravatar.com/avatar/9a7fd6d3620a4a9d9de3bd55d5266887?s=80\u0026d=identicon","web_url":"https://gitlab.com/Thasim"},"resolve_outdated_diff_discussions":false,"container_expiration_policy":{"cadence":"1d","enabled":false,"keep_n":10,"older_than":"90d","name_regex":".*","name_regex_keep":null,"next_run_at":"2023-12-16T05:02:08.967Z"},"issues_enabled":true,"merge_requests_enabled":true,"wiki_enabled":true,"jobs_enabled":true,"snippets_enabled":true,"container_registry_enabled":true,"service_desk_enabled":true,"service_desk_address":"contact-project+thasim-callisto-53081866-issue-@incoming.gitlab.com","can_create_merge_request_in":true,"issues_access_level":"enabled","repository_access_level":"enabled","merge_requests_access_level":"enabled","forking_access_level":"enabled","wiki_access_level":"enabled","builds_access_level":"enabled","snippets_access_level":"enabled","pages_access_level":"private","analytics_access_level":"enabled","container_registry_access_level":"enabled","security_and_compliance_access_level":"private","releases_access_level":"enabled","environments_access_level":"enabled","feature_flags_access_level":"enabled","infrastructure_access_level":"enabled","monitor_access_level":"enabled","model_experiments_access_level":"enabled","model_registry_access_level":"enabled","emails_disabled":false,"emails_enabled":true,"shared_runners_enabled":true,"lfs_enabled":true,"creator_id":19228764,"import_url":null,"import_type":null,"import_status":"none","import_error":null,"open_issues_count":0,"description_html":"","updated_at":"2023-12-15T05:02:08.928Z","ci_default_git_depth":20,"ci_forward_deployment_enabled":true,"ci_forward_deployment_rollback_allowed":true,"ci_job_token_scope_enabled":false,"ci_separated_caches":true,"ci_allow_fork_pipelines_to_run_in_parent_project":true,"build_git_strategy":"fetch","keep_latest_artifact":true,"restrict_user_defined_variables":false,"runners_token":"GR1348941eJr87Yy6rvgcPGEZxkjR","runner_token_expiration_interval":null,"group_runners_enabled":true,"auto_cancel_pending_pipelines":"enabled","build_timeout":3600,"auto_devops_enabled":false,"auto_devops_deploy_strategy":"continuous","ci_config_path":"","public_jobs":true,"shared_with_groups":[],"only_allow_merge_if_pipeline_succeeds":false,"allow_merge_on_skipped_pipeline":null,"request_access_enabled":true,"only_allow_merge_if_all_discussions_are_resolved":false,"remove_source_branch_after_merge":true,"printing_merge_request_link_enabled":true,"merge_method":"merge","squash_option":"default_off","enforce_auth_checks_on_uploads":true,"suggestion_commit_message":null,"merge_commit_template":null,"squash_commit_template":null,"issue_branch_template":null,"autoclose_referenced_issues":true,"external_authorization_classification_label":"","requirements_enabled":false,"requirements_access_level":"enabled","security_and_compliance_enabled":true,"compliance_frameworks":[]}